num_ticket,fecha,asunto,usuario,prioridad,departamento,tipo,fuente,estado_actual,atraso,contesta,agente,equipo,lider,srn,correcciones,prevenciones,prioridad_corregida,prioridad_final
111258,11/5/2024 14:39,ERROR 504,dramirez,Urgente,Departamento de soporte de SAP JDE,Incidente / Problema,Web,Cerrado,0,1,jsarango,Equipo de soporte de SAP,,,,,Urgente,Urgente
695609,11/7/2024 14:04,Actualización de BPM de 3.1 a 3.3,aperez,Normal,Departamento Técnico Interno,Incidente / Problema,Correo electrónico,Resuelto,1,1,msandoval,Equipo de AWS,,,,,Normal,Normal
696690,11/8/2024 11:05,Página de error de producción JDE 04 de diciembre de 2019,avargas,Normal,Departamento de soporte de SAP JDE,Pedido,Web,Abierto,1,1,nenriquez,Equipo de soporte de JDE,,,,,Normal,Normal
111469,11/8/2024 11:58,Página de error en la interfaz de la hoja de cálculo BEE,jcastro,Alta,Departamento de soporte de SAP JDE,Incidente / Problema,Web,Cerrado,0,1,jsarango,Equipo de soporte de JDE,,,,,Alta,Alta
694866,11/8/2024 15:26,[SAP] Término Activar un Estudiante,smartinez,Alta,Departamento de soporte de SAP JDE,Pedido,Correo electrónico,Cerrado,0,0,msandoval,BPM - Equipo de soporte de ProcessMaker,,,,,Alta,Alta
111417,11/11/2024 8:05,Problema del espacio de trabajo después de actualizar la versión de BPM,drodriguez,Alta,Departamento Técnico Interno,Incidente / Problema,Web,Cerrado,0,1,jsarango,BPM - Equipo de soporte de ProcessMaker,,,,,Alta,Alta
111615,11/11/2024 8:18,"Problema posterior: Aparece el mensaje ""No queda espacio en el dispositivo""",avargas,Normal,Departamento de soporte de SAP JDE,Incidente / Problema,Web,Cerrado,0,1,jsarango,Equipo de soporte de SAP,,,,,Normal,Normal
695377,11/11/2024 16:25,Cómo prevenir la inyección de nuestra API a SQL,jvargas,Normal,Departamento de soporte de SAP JDE,Pedido,Web,Abierto,0,0,msandoval,Equipo de soporte de SAP,,,,,Normal,Normal
694889,11/13/2024 11:55,El cajero no puede usar la búsqueda en SAP (UPCEB),dvargas,Normal,Departamento de soporte de SAP JDE,Pedido,Correo electrónico,Abierto,0,1,jsarango,Equipo de AWS,,,,,Normal,Normal
111526,11/13/2024 14:03,"Envío de notificaciones por correo electrónico (año académico 2020-2021, 1.er semestre)",lcastro,Normal,Departamento de soporte de SAP JDE,Incidente / Problema,Web,Cerrado,0,1,jsarango,Equipo de soporte de SAP,,,,,Normal,Normal
111241,11/14/2024 12:46,Migración de proyecto de instancia DEV a PROD,svargas,Normal,Departamento de soporte de SAP JDE,Pedido,Web,Cerrado,0,1,jsarango,Equipo de soporte de SAP,,,,,Baja,Baja
696189,11/15/2024 8:28,Oracle Web ADI: Error fatal,scastro,Alta,Departamento de soporte de SAP JDE,Pedido,Web,Cerrado,1,0,msandoval,Equipo de soporte de SAP,,,,,Alta,Alta
695090,11/15/2024 13:09,El servidor DEV no puede iniciarse,srodriguez,Alta,Departamento Técnico Interno,Pedido,Web,Abierto,1,0,nenriquez,Equipo de hardware,,,,,Alta,Alta
695827,11/15/2024 15:07,Problema posterior: No puedo iniciar sesión en SAP,jperez,Normal,Departamento Técnico Interno,Incidente / Problema,Web,Abierto,0,1,rmorillo,Equipo de hardware,,,,,Normal,Normal
111296,11/18/2024 8:42,Error de producción de JDE en la validación de DV,sperez,Alta,Departamento de soporte de SAP JDE,Incidente / Problema,Web,Cerrado,0,1,jsarango,Equipo de soporte de JDE,,,,,Alta,Alta
696207,11/18/2024 9:37,Actualizar la página de destino,llopez,Alta,Departamento Técnico Interno,Pedido,Web,Cerrado,0,0,mjacome,Equipo de red,,,,,Alta,Alta
696165,11/18/2024 9:47,Solicitud de acceso público,mcastro,Normal,Departamento de soporte de SAP JDE,Pedido,Correo electrónico,Cerrado,0,0,nenriquez,Equipo de Salesforce,,,,,Normal,Normal
695329,11/18/2024 12:15,Error de importación del diario,mlopez,Normal,Departamento de soporte de SAP JDE,Incidente / Problema,Correo electrónico,Cerrado,1,1,nenriquez,BPM - Equipo de soporte de ProcessMaker,,,,,Normal,Normal
695068,11/18/2024 14:23,Problema de cálculo de matrícula,jlopez,Normal,Departamento Técnico Interno,Pedido,Correo electrónico,Abierto,1,1,jsarango,Equipo de Salesforce,,,,,Normal,Normal
111542,11/18/2024 15:05,Error de comunicación con el cliente SQL (sistema HRIS),cgomez,Normal,Departamento Técnico Interno,Incidente / Problema,Correo electrónico,Cerrado,0,1,jsarango,Equipo de red,,,,,Normal,Normal
695901,11/18/2024 15:40,Información STC,lvargas,Alta,Departamento de soporte de SAP JDE,Incidente / Problema,Correo electrónico,Resuelto,0,0,spaez,Equipo de mesa de ayuda,,,,,,Urgente
111226,11/18/2024 16:03,No se pueden eliminar registros duplicados de 3 empleados,arodriguez,Normal,Departamento de soporte de SAP JDE,Incidente / Problema,Web,Cerrado,0,1,jsarango,Equipo de soporte de JDE,,,,,Normal,Normal
696231,11/18/2024 16:20,No puedo conectarme al VPN,alopez,Baja,Departamento Técnico Interno,Incidente / Problema,Web,Abierto,0,1,mjacome,Equipo de Workday,,,,,,Urgente
695011,11/19/2024 8:09,PeopleTools 8.57 en la máquina cliente,mmartinez,Normal,Departamento Técnico Interno,Incidente / Problema,Correo electrónico,Resuelto,0,0,mjacome,Equipo de soporte de SAP,,,,,Normal,Normal
696385,11/22/2024 11:11,Pruebas assdasd,cvargas,Normal,Departamento Técnico Interno,Pedido,Correo electrónico,Resuelto,1,1,msandoval,Equipo de hardware,,,,,Normal,Normal
696435,11/22/2024 11:51,Saldo vencido publicado en el Centro de Estudiantes,aperez,Normal,Departamento Técnico Interno,Incidente / Problema,Web,Cerrado,0,0,nenriquez,Equipo de hardware,,,,,Normal,Normal
111320,11/22/2024 11:55,Transacciones de órdenes de compra diferidas,lperez,Alta,Departamento de soporte de SAP JDE,Incidente / Problema,Web,Cerrado,0,1,jsarango,Equipo de soporte de JDE,,,,,Normal,Normal
696033,11/22/2024 15:39,Reemplazar el correo electrónico real en la instancia de PRUEBA,lvargas,Alta,Departamento Técnico Interno,Pedido,Correo electrónico,Resuelto,1,1,rmorillo,Equipo de hardware,,,,,Alta,Alta
695921,11/25/2024 11:47,Sobrecarga de unidades,jrodriguez,Normal,Departamento Técnico Interno,Pedido,Correo electrónico,Resuelto,1,0,msandoval,Equipo de red,,,,,Normal,Normal
696475,11/26/2024 8:42,Política Institucional ARCH 2025,cperez,Urgente,Departamento Técnico Interno,Pedido,Web,Cerrado,0,0,spaez,Equipo de soporte de SAP,,,,,,Normal
695418,11/28/2024 11:09,Problema con la hoja de cálculo BEE,jramirez,Normal,Departamento Técnico Interno,Incidente / Problema,Correo electrónico,Abierto,0,0,msandoval,Equipo de Workday,,,,,Normal,Normal
696456,11/28/2024 14:14,Creación de usuario para el permiso de Integration Broker,mfernandez,Normal,Departamento Técnico Interno,Incidente / Problema,Web,Cerrado,0,1,msandoval,BPM - Equipo de soporte de ProcessMaker,,,,,Normal,Normal
696370,11/29/2024 8:05,Uso del disco al 100% (Windows 10),dgomez,Normal,Departamento de soporte de SAP JDE,Pedido,Correo electrónico,Resuelto,1,1,rmorillo,Equipo de red,,,,,Normal,Normal
696603,11/29/2024 9:02,Migración de proyecto de instancia DEV a PROD,svargas,Normal,Departamento Técnico Interno,Incidente / Problema,Correo electrónico,Abierto,0,1,jsarango,Equipo de AWS,,,,,Baja,Baja
696251,11/29/2024 9:48,Solicitud de acceso público,cvargas,Normal,Departamento de soporte de SAP JDE,Pedido,Web,Resuelto,1,1,spaez,Equipo de Salesforce,,,,,Normal,Normal
111147,11/29/2024 11:28,NO PUEDO INICIAR SESIÓN EN SAP,dperez,Urgente,Departamento de soporte de SAP JDE,Incidente / Problema,Web,Cerrado,0,1,jsarango,Equipo de soporte de SAP,,,,,Urgente,Urgente
695695,12/2/2024 11:04,JDE PROD - Problema de aprobación del informe de gastos,dgomez,Normal,Departamento Técnico Interno,Pedido,Correo electrónico,Resuelto,1,0,msandoval,Equipo de hardware,,,,,Normal,Normal
695320,12/2/2024 16:23,Disco duro defectuoso,arodriguez,Normal,Departamento Técnico Interno,Incidente / Problema,Correo electrónico,Cerrado,0,0,nenriquez,Equipo de mesa de ayuda,,,,,Normal,Normal
111340,12/3/2024 14:19,No se puede conectar a la VPN,clopez,Normal,Departamento de soporte de SAP JDE,Pedido,Web,Cerrado,0,1,jsarango,Equipo de AWS,,,,,Normal,Normal
696359,12/4/2024 10:33,Oracle HRMS - Configuración de entrada de elementos,jfernandez,Urgente,Departamento de soporte de SAP JDE,Pedido,Correo electrónico,Resuelto,1,0,nenriquez,Equipo de Workday,,,,,Urgente,Urgente
111243,12/4/2024 12:41,Sistema de causas judiciales - Causa penal,dperez,Alta,Departamento Técnico Interno,Incidente / Problema,Web,Abierto,1,0,jsarango,Equipo de mesa de ayuda,,,,,Alta,Alta
695777,12/5/2024 13:34,Adjunto URL - Autorización para rellenar,mvargas,Alta,Departamento Técnico Interno,Pedido,Web,Resuelto,0,1,jsarango,Equipo de AWS,,,,,Alta,Alta
695004,12/6/2024 8:05,Error de aprobación de DV,cmorales,Normal,Departamento Técnico Interno,Incidente / Problema,Correo electrónico,Cerrado,0,1,rmorillo,Equipo de hardware,,,,,Normal,Normal
696583,12/6/2024 8:12,CONFIGURACIÓN DE PALO ALTO,lrodriguez,Normal,Departamento Técnico Interno,Pedido,Correo electrónico,Abierto,1,1,nenriquez,Equipo de soporte de JDE,,,,,Normal,Normal
694946,12/6/2024 10:29,Crear función específica en la Responsabilidad,jperez,Urgente,Departamento de soporte de SAP JDE,Incidente / Problema,Web,Cerrado,1,1,jsarango,Equipo de Salesforce,,,,,Urgente,Urgente
695374,12/6/2024 11:15,JDE PROD - Informe de gastos de tiempo de espera (22 de abril de 2019),mfernandez,Alta,Departamento Técnico Interno,Pedido,Web,Cerrado,0,1,rmorillo,Equipo de hardware,,,,,Alta,Alta
695732,12/6/2024 11:24,Instalación impresora,vgomez,Alta,Departamento Técnico Interno,Pedido,Correo electrónico,Cerrado,0,1,jsarango,Equipo de red,,,,,,Urgente
696488,12/10/2024 10:21,Problema de ADI web,avargas,Alta,Departamento Técnico Interno,Pedido,Web,Cerrado,1,1,msandoval,Equipo de Salesforce,,,,,Alta,Alta
695383,12/11/2024 8:58,[Solo prueba]:::[SAP]Página no disponible,mmorales,Normal,Departamento de soporte de SAP JDE,Pedido,Web,Abierto,0,1,nenriquez,Equipo de Workday,,,,,Normal,Normal
695612,12/11/2024 14:24,ERROR DE DATOS EN LA INSTANCIA DE PRODUCCIÓN,sgomez,Normal,Departamento Técnico Interno,Incidente / Problema,Correo electrónico,Abierto,1,1,rmorillo,Equipo de mesa de ayuda,,,,,Normal,Normal
111617,12/11/2024 15:46,Problema del agente de integración,lvargas,Normal,Departamento de soporte de SAP JDE,Incidente / Problema,Web,Cerrado,0,1,jsarango,Equipo de soporte de SAP,,,,,Normal,Normal
111251,12/12/2024 9:33,Se produce un error en la organización,mperez,Normal,Departamento de soporte de SAP JDE,Incidente / Problema,Web,Cerrado,0,1,jsarango,Equipo de soporte de JDE,,,,,Normal,Normal
111110,12/13/2024 12:37,Informe de gastos de aprobación de AME con estado diferido,dfernandez,Normal,Departamento de soporte de SAP JDE,Incidente / Problema,Correo electrónico,Cerrado,0,1,nenriquez,Equipo de soporte de JDE,,,,,Normal,Normal
695452,12/16/2024 9:09,JDE PROD - Problema de aprobación del informe de gastos,alopez,Normal,Departamento Técnico Interno,Incidente / Problema,Web,Resuelto,1,0,mjacome,Equipo de mesa de ayuda,,,,,Normal,Normal
696661,12/16/2024 13:15,Solicitud de actualización del enlace de la Política de Privacidad,vvargas,Normal,Departamento de soporte de SAP JDE,Pedido,Correo electrónico,Cerrado,1,0,msandoval,Equipo de Workday,,,,,Normal,Normal
696559,12/16/2024 15:15,Instalar Firma EC,mmorales,Baja,Departamento Técnico Interno,Incidente / Problema,Web,Abierto,0,0,spaez,Equipo de Salesforce,,,,,,Baja
695637,12/17/2024 11:27,No se obtuvieron resultados de búsqueda en CS 9.2,lcastro,Baja,Departamento Técnico Interno,Pedido,Correo electrónico,Cerrado,0,0,mjacome,Equipo de Workday,,,,,Baja,Baja
696252,12/17/2024 13:30,PEDIDO DE MATERIALES,cvargas,Normal,Departamento Técnico Interno,Pedido,Web,Resuelto,1,1,nenriquez,Equipo de hardware,,,,,,Normal
695050,12/17/2024 14:20,Error al finalizar la inscripción,ccastro,Urgente,Departamento de soporte de SAP JDE,Pedido,Web,Cerrado,1,1,mjacome,Equipo de Workday,,,,,Urgente,Urgente
696069,12/18/2024 14:34,Actualización de producción de Processmaker 3.3.7,mfernandez,Normal,Departamento de soporte de SAP JDE,Incidente / Problema,Correo electrónico,Resuelto,1,1,rmorillo,Equipo de Salesforce,,,,,Normal,Normal
695651,12/19/2024 10:51,Ver informes PMP de todos los usuarios,vgomez,Normal,Departamento de soporte de SAP JDE,Pedido,Correo electrónico,Resuelto,0,0,mjacome,Equipo de soporte de SAP,,,,,Normal,Normal
696186,12/19/2024 12:36,Error en mi tabla ReqJDEition,cmartinez,Normal,Departamento de soporte de SAP JDE,Incidente / Problema,Web,Abierto,1,0,msandoval,Equipo de soporte de SAP,,,,,Normal,Normal
695118,12/19/2024 16:25,Configuración de acceso al servidor MYSQL,vperez,Normal,Departamento de soporte de SAP JDE,Pedido,Correo electrónico,Abierto,0,1,jsarango,Equipo de Workday,,,,,Normal,Normal
111619,12/20/2024 8:06,Problemas en el Informe de Becarios de Nómina General de UP,aramirez,Normal,Departamento de soporte de SAP JDE,Incidente / Problema,Web,Cerrado,0,1,jsarango,Equipo de soporte de JDE,,,,,Normal,Normal
695407,12/20/2024 9:26,SOLICITUD DE CAMBIO DE FIRMA JURÍDICA EN SISTEMA DE FACTURACIÓN,lvargas,Alta,Departamento de soporte de SAP JDE,Incidente / Problema,Web,Abierto,1,1,rmorillo,Equipo de mesa de ayuda,,,,,,Baja
695449,12/20/2024 9:35,Actualización de datos de contacto (página de destino),cfernandez,Normal,Departamento de soporte de SAP JDE,Pedido,Web,Resuelto,0,0,rmorillo,Equipo de red,,,,,Normal,Normal
695776,12/20/2024 10:55,Error de Windows,dvargas,Normal,Departamento Técnico Interno,Pedido,Correo electrónico,Resuelto,1,0,spaez,Equipo de hardware,,,,,Normal,Normal
111129,12/23/2024 9:29,Total de unidades aprobadas,jmartinez,Alta,Departamento de soporte de SAP JDE,Incidente / Problema,Web,Cerrado,0,1,jsarango,Equipo de soporte de SAP,,,,,Alta,Alta
111203,12/24/2024 8:16,JDE PROD - Estado de error de las transacciones,cfernandez,Alta,Departamento de soporte de SAP JDE,Incidente / Problema,Web,Cerrado,0,1,jsarango,Equipo de soporte de JDE,,,,,Alta,Alta
111440,12/25/2024 10:28,Portátil de rendimiento lento,vgomez,Normal,Departamento Técnico Interno,Incidente / Problema,Correo electrónico,Cerrado,0,1,jsarango,Equipo de red,,,,,Normal,Normal
696008,12/25/2024 11:32,Error al iniciar sesión,smorales,Normal,Departamento Técnico Interno,Incidente / Problema,Web,Abierto,0,0,rmorillo,Equipo de Salesforce,,,,,Normal,Normal
695540,12/27/2024 8:33,Generando el informe CHED_FT_2018,sramirez,Normal,Departamento de soporte de SAP JDE,Pedido,Correo electrónico,Resuelto,0,0,nenriquez,Equipo de soporte de SAP,,,,,Normal,Normal
695413,12/27/2024 8:38,Instancia de desarrollo | Problema de vista de registro,jcastro,Alta,Departamento de soporte de SAP JDE,Pedido,Correo electrónico,Resuelto,1,1,jsarango,Equipo de hardware,,,,,Alta,Alta
695073,12/27/2024 8:48,Página de error de conexión segura - Instancia TEST,vmartinez,Normal,Departamento de soporte de SAP JDE,Incidente / Problema,Correo electrónico,Resuelto,1,0,msandoval,Equipo de Salesforce,,,,,Normal,Normal
695545,12/27/2024 9:31,Aplicar parche,srodriguez,Baja,Departamento Técnico Interno,Incidente / Problema,Correo electrónico,Cerrado,1,0,mjacome,BPM - Equipo de soporte de ProcessMaker,,,,,Baja,Baja
695269,12/27/2024 11:24,Cita para reportar error de REPS,mgomez,Normal,Departamento de soporte de SAP JDE,Incidente / Problema,Web,Resuelto,1,1,nenriquez,Equipo de Workday,,,,,Normal,Normal
694833,12/27/2024 13:17,Error al enviar notificación.,vlopez,Normal,Departamento de soporte de SAP JDE,Incidente / Problema,Web,Cerrado,0,0,spaez,Equipo de soporte de JDE,,,,,Normal,Normal
695045,12/27/2024 15:35,El servidor no se pudo iniciar (servidor de aplicaciones),mvargas,Alta,Departamento de soporte de SAP JDE,Pedido,Web,Cerrado,0,0,mjacome,BPM - Equipo de soporte de ProcessMaker,,,,,Alta,Alta
696428,12/30/2024 8:46,JDE PROD - Página de error (03 de mayo de 2019),jrodriguez,Normal,Departamento Técnico Interno,Pedido,Web,Abierto,1,0,spaez,Equipo de Salesforce,,,,,Normal,Normal
696616,12/30/2024 10:14,Acceso a Zoom Urgente,dcastro,Urgente,Departamento Técnico Interno,Incidente / Problema,Web,Abierto,0,0,mjacome,Equipo de hardware,,,,,,Normal
695787,12/30/2024 10:26,Instancia de prueba de JDE no accesible,dfernandez,Normal,Departamento Técnico Interno,Pedido,Web,Cerrado,0,1,nenriquez,Equipo de Salesforce,,,,,Normal,Normal
694843,12/30/2024 11:42,Procesar múltiples ejecuciones de nómina de empleados,cvargas,Normal,Departamento de soporte de SAP JDE,Pedido,Web,Cerrado,0,0,spaez,Equipo de mesa de ayuda,,,,,Normal,Normal
695788,12/30/2024 13:08,Reinicio de PALO ALTO,mrodriguez,Alta,Departamento Técnico Interno,Pedido,Correo electrónico,Resuelto,0,1,nenriquez,Equipo de soporte de SAP,,,,,Alta,Alta
695441,12/30/2024 13:37,No se puede realizar la búsqueda después del reinicio,clopez,Normal,Departamento Técnico Interno,Pedido,Web,Cerrado,0,1,msandoval,Equipo de hardware,,,,,Normal,Normal
695710,12/30/2024 16:26,"Salida de expresión en el Administrador de consultas,",vrodriguez,Normal,Departamento Técnico Interno,Pedido,Correo electrónico,Resuelto,1,1,nenriquez,BPM - Equipo de soporte de ProcessMaker,,,,,Normal,Normal
695752,12/31/2024 10:49,Notificaciones,llopez,Alta,Departamento Técnico Interno,Pedido,Web,Cerrado,1,0,msandoval,Equipo de red,,,,,Alta,Alta
695225,1/3/2025 8:21,Error en el acceso a la autoridad para contratar,mmorales,Normal,Departamento de soporte de SAP JDE,Pedido,Correo electrónico,Cerrado,0,0,mjacome,Equipo de soporte de JDE,,,,,Normal,Normal
111282,1/3/2025 8:53,Error en solicitud de proceso.,mgomez,Normal,Departamento de soporte de SAP JDE,Incidente / Problema,Web,Cerrado,0,1,jsarango,Equipo de soporte de SAP,,,,,Normal,Normal
696565,1/3/2025 9:43,El monto del pago programado es diferente del monto del DV,dgomez,Alta,Departamento Técnico Interno,Incidente / Problema,Web,Abierto,0,0,spaez,Equipo de Workday,,,,,Alta,Alta
696198,1/3/2025 11:37,Autoservicio - Información legislativa,vmorales,Alta,Departamento Técnico Interno,Pedido,Correo electrónico,Abierto,1,1,jsarango,Equipo de AWS,,,,,Alta,Alta
694811,1/3/2025 12:55,Zoom no se puede instalar,mlopez,Normal,Departamento de soporte de SAP JDE,Pedido,Correo electrónico,Abierto,1,0,rmorillo,Equipo de Workday,,,,,Normal,Normal
111545,1/3/2025 14:26,Restablecimiento de contraseña de VPN,cfernandez,Normal,Departamento Técnico Interno,Pedido,Web,Cerrado,0,1,jsarango,Equipo de mesa de ayuda,,,,,Normal,Normal
695100,1/6/2025 9:09,Problema SMTP en SAP Prod,ccastro,Normal,Departamento Técnico Interno,Pedido,Correo electrónico,Cerrado,0,0,jsarango,Equipo de soporte de JDE,,,,,Normal,Normal
696450,1/6/2025 12:01,Modificación de campos en Aprendizaje Externo,ccastro,Normal,Departamento de soporte de SAP JDE,Incidente / Problema,Web,Resuelto,1,1,mjacome,Equipo de Workday,,,,,Normal,Normal
695748,1/7/2025 10:43,Revisión de la información de contacto,lvargas,Normal,Departamento Técnico Interno,Incidente / Problema,Correo electrónico,Resuelto,0,0,msandoval,Equipo de soporte de SAP,,,,,Normal,Normal
111342,1/7/2025 15:41,PROD: CoS - El registro ya ha sido ingresado,acastro,Normal,Departamento de soporte de SAP JDE,Incidente / Problema,Web,Cerrado,0,1,jsarango,Equipo de soporte de JDE,,,,,Normal,Normal
111150,1/8/2025 8:55,Informar de un problema,llopez,Normal,Departamento de soporte de SAP JDE,Incidente / Problema,Web,Cerrado,0,1,jsarango,Equipo de soporte de SAP,,,,,Normal,Normal
695550,1/9/2025 8:05,Base salarial,dramirez,Alta,Departamento Técnico Interno,Incidente / Problema,Correo electrónico,Resuelto,1,0,mjacome,Equipo de Salesforce,,,,,Alta,Alta
695393,1/9/2025 10:09,Salida del analizador técnico de RR.HH.,svargas,Normal,Departamento de soporte de SAP JDE,Pedido,Web,Cerrado,0,1,rmorillo,Equipo de AWS,,,,,Normal,Normal
695859,1/10/2025 10:31,Error en el cálculo de la matrícula,dcastro,Normal,Departamento de soporte de SAP JDE,Incidente / Problema,Correo electrónico,Abierto,1,1,msandoval,Equipo de mesa de ayuda,,,,,Normal,Normal
695560,1/10/2025 12:58,Instancia de prueba JDE: criterios de búsqueda de notificaciones,mlopez,Normal,Departamento de soporte de SAP JDE,Pedido,Web,Cerrado,0,1,jsarango,Equipo de mesa de ayuda,,,,,Normal,Normal
111105,1/10/2025 15:54,Generando el informe CHED_FT_2018,lfernandez,Normal,Departamento de soporte de SAP JDE,Incidente / Problema,Correo electrónico,Cerrado,0,1,msandoval,Equipo de soporte de SAP,,,,,Normal,Normal
696143,1/13/2025 9:20,Eliminar el acceso a la página de inscripción,dfernandez,Normal,Departamento Técnico Interno,Pedido,Web,Resuelto,0,0,msandoval,Equipo de Salesforce,,,,,Normal,Normal
696700,1/13/2025 12:15,Problema COS: Observaciones faltantes,arodriguez,Alta,Departamento Técnico Interno,Pedido,Web,Resuelto,0,1,msandoval,Equipo de Salesforce,,,,,Alta,Alta
111356,1/13/2025 16:22,Error de envío de orden de compra en la instancia de prueba,jrodriguez,Normal,Departamento de soporte de SAP JDE,Incidente / Problema,Web,Cerrado,0,1,jsarango,Equipo de soporte de JDE,,,,,Normal,Normal
696221,1/14/2025 13:09,Solicitar ECI para la página del asesor estudiantil,llopez,Baja,Departamento Técnico Interno,Incidente / Problema,Correo electrónico,Cerrado,0,0,rmorillo,Equipo de hardware,,,,,Baja,Baja
696606,1/14/2025 13:09,prueba de alertas por correo electrónico,vmorales,Normal,Departamento Técnico Interno,Pedido,Web,Resuelto,1,0,spaez,Equipo de Workday,,,,,Normal,Normal
111410,1/15/2025 10:49,Actualización de producción de Processmaker 3.3.7,mfernandez,Normal,Departamento Técnico Interno,Incidente / Problema,Correo electrónico,Cerrado,0,1,nenriquez,Equipo de Workday,,,,,Normal,Normal
695398,1/15/2025 14:03,Encuentre la tabla de Oracle de ocupación de puestos,mperez,Alta,Departamento Técnico Interno,Incidente / Problema,Web,Abierto,0,0,spaez,Equipo de soporte de SAP,,,,,Alta,Alta
696526,1/17/2025 8:18,Actualizar la página de destino,dmartinez,Alta,Departamento de soporte de SAP JDE,Pedido,Correo electrónico,Resuelto,0,1,nenriquez,Equipo de soporte de SAP,,,,,Alta,Alta
111365,1/17/2025 11:20,Compatibilidad de Windows 10 en Palo Alto,srodriguez,Normal,Departamento Técnico Interno,Pedido,Web,Cerrado,0,1,nenriquez,Equipo de red,,,,,Normal,Normal
695425,1/17/2025 12:45,No se puede generar el informe después de la degradación de la base de datos,mvargas,Alta,Departamento de soporte de SAP JDE,Pedido,Web,Resuelto,0,0,mjacome,Equipo de AWS,,,,,Alta,Alta
694878,1/20/2025 12:10,Tiempo de inactividad de JDE (billete posterior a la emisión),jlopez,Normal,Departamento Técnico Interno,Pedido,Web,Abierto,1,0,nenriquez,Equipo de soporte de JDE,,,,,Normal,Normal
696377,1/20/2025 15:19,Solicitud para reiniciar nuevamente el SAP Dev Server,dgomez,Normal,Departamento de soporte de SAP JDE,Pedido,Correo electrónico,Abierto,0,1,mjacome,Equipo de hardware,,,,,Normal,Normal
696491,1/24/2025 10:18,Error al agregar nuevas tablas en el registro de auditoría,sfernandez,Baja,Departamento Técnico Interno,Pedido,Correo electrónico,Abierto,1,1,mjacome,Equipo de soporte de SAP,,,,,Baja,Baja
111362,1/24/2025 10:44,Contraseña de VPN,cmorales,Normal,Departamento de soporte de SAP JDE,Pedido,Web,Cerrado,0,1,jsarango,Equipo de AWS,,,,,Normal,Normal
695768,1/24/2025 11:07,Error WGET.SH encontrado,vgomez,Baja,Departamento Técnico Interno,Pedido,Correo electrónico,Resuelto,1,1,msandoval,Equipo de red,,,,,Baja,Baja
694818,1/24/2025 12:16,Error de mensaje del módulo de relación,mcastro,Normal,Departamento de soporte de SAP JDE,Pedido,Correo electrónico,Abierto,1,1,msandoval,Equipo de soporte de JDE,,,,,Normal,Normal
111541,1/24/2025 14:06,La computadora portátil funciona lenta,mvargas,Normal,Departamento Técnico Interno,Incidente / Problema,Correo electrónico,Cerrado,0,1,jsarango,Equipo de red,,,,,Normal,Normal
695058,1/27/2025 10:28,Error al acceder a SAP.EDU.PH,svargas,Normal,Departamento Técnico Interno,Incidente / Problema,Web,Resuelto,1,0,mjacome,Equipo de Salesforce,,,,,Normal,Normal
695173,1/27/2025 13:02,No puedo iniciar sesión en la cuenta de usuario,dlopez,Alta,Departamento de soporte de SAP JDE,Pedido,Web,Cerrado,1,1,nenriquez,Equipo de soporte de SAP,,,,,Alta,Alta
695110,1/28/2025 12:12,[AYUDA] Actualizar Process Maker,jcastro,Baja,Departamento Técnico Interno,Pedido,Web,Abierto,0,1,spaez,Equipo de red,,,,,Baja,Baja
111540,1/28/2025 14:29,Nombre del proceso de capacitación,vramirez,Baja,Departamento de soporte de SAP JDE,Pedido,Web,Abierto,0,0,msandoval,Equipo de soporte de JDE,,,,,Baja,Baja
695159,1/29/2025 10:04,JDE PROD - Error al actualizar la configuración de AME,dvargas,Alta,Departamento de soporte de SAP JDE,Incidente / Problema,Web,Cerrado,0,1,mjacome,Equipo de red,,,,,Alta,Alta
695017,1/29/2025 11:00,Problema del agente de integración (TEST),cramirez,Normal,Departamento de soporte de SAP JDE,Incidente / Problema,Web,Abierto,1,0,mjacome,Equipo de soporte de JDE,,,,,Normal,Normal
695961,1/30/2025 8:05,Modificación de campos en Aprendizaje Externo,mvargas,Normal,Departamento Técnico Interno,Incidente / Problema,Web,Abierto,0,1,mjacome,Equipo de AWS,,,,,Normal,Normal
695065,1/31/2025 9:10,Baliwag - Error de escritorio,mlopez,Normal,Departamento de soporte de SAP JDE,Pedido,Correo electrónico,Abierto,1,1,nenriquez,Equipo de red,,,,,Normal,Normal
696051,1/31/2025 9:20,Error de producción de JDE: falla del servidor web (08 de abril de 2019),jfernandez,Urgente,Departamento Técnico Interno,Pedido,Correo electrónico,Resuelto,1,0,mjacome,Equipo de AWS,,,,,Urgente,Urgente
695457,1/31/2025 11:31,Error al finalizar la inscripción,Agomez,Urgente,Departamento de soporte de SAP JDE,Incidente / Problema,Correo electrónico,Abierto,0,0,rmorillo,Equipo de soporte de JDE,,,,,Urgente,Urgente
111133,1/31/2025 11:32,Error en el envío del PPMP,Agomez,Alta,Departamento de soporte de SAP JDE,Incidente / Problema,Web,Cerrado,0,1,jsarango,Equipo de soporte de JDE,,,,,Alta,Alta
