num_ticket,fecha,asunto,usuario,prioridad,departamento,tipo,fuente,estado_actual,atraso,contesta,agente,equipo,lider,srn,correcciones,prevenciones,prioridad_corregida,prioridad_final
695235,1/15/2024 11:45,JDE Prod no disponible (08 de agosto de 2019),vmorales,Urgente,Departamento Técnico Interno,Pedido,Correo electrónico,Cerrado,1,0,spaez,Equipo de Workday,,,,,Urgente,Urgente
695451,1/15/2024 12:21,SPMS - Página del aprobador,cfernandez,Alta,Departamento de soporte de SAP JDE,Incidente / Problema,Correo electrónico,Resuelto,1,0,mjacome,Equipo de soporte de SAP,,,,,Alta,Alta
695886,1/15/2024 12:56,Problema del agente de integración,jramirez,Normal,Departamento Técnico Interno,Incidente / Problema,Web,Abierto,1,1,mjacome,Equipo de soporte de JDE,,,,,Normal,Normal
696463,1/15/2024 13:34,Problema con la hoja de cálculo BEE,lperez,Normal,Departamento de soporte de SAP JDE,Pedido,Correo electrónico,Abierto,1,0,msandoval,Equipo de red,,,,,Normal,Normal
111414,1/15/2024 14:19,Ejecutar archivo SQR en CS 9.2,sfernandez,Baja,Departamento de soporte de SAP JDE,Pedido,Web,Abierto,0,0,rmorillo,Equipo de soporte de SAP,,,,,Baja,Baja
695829,1/16/2024 14:36,Error de producción de JDE: falla del servidor web (08 de abril de 2019),vcastro,Urgente,Departamento Técnico Interno,Pedido,Web,Resuelto,0,1,rmorillo,Equipo de Salesforce,,,,,Urgente,Urgente
111230,1/17/2024 8:01,Instancia de prueba de JDE no accesible,lperez,Normal,Departamento de soporte de SAP JDE,Incidente / Problema,Web,Cerrado,0,1,jsarango,Equipo de soporte de JDE,,,,,Normal,Normal
695968,1/18/2024 9:58,Error: No se puede acceder al sitio,dmartinez,Normal,Departamento Técnico Interno,Pedido,Web,Resuelto,1,1,rmorillo,Equipo de AWS,,,,,Normal,Normal
695495,1/18/2024 12:27,Instalación del sistema operativo para el cliente DOT,vcastro,Normal,Departamento Técnico Interno,Incidente / Problema,Web,Abierto,0,1,mjacome,Equipo de AWS,,,,,Normal,Normal
695851,1/18/2024 14:28,Desaceleración de producción de JDE 19 de marzo de 2019,vramirez,Alta,Departamento de soporte de SAP JDE,Pedido,Correo electrónico,Abierto,0,1,rmorillo,BPM - Equipo de soporte de ProcessMaker,,,,,Alta,Alta
696023,1/18/2024 16:14,"Desaceleración de JDE, 4 de febrero de 2019",cvargas,Urgente,Departamento de soporte de SAP JDE,Incidente / Problema,Correo electrónico,Abierto,0,0,rmorillo,Equipo de soporte de SAP,,,,,Urgente,Urgente
695830,1/19/2024 11:27,Anexo UPMin de Cuentas por Pagar de JDE,cgomez,Normal,Departamento Técnico Interno,Pedido,Correo electrónico,Cerrado,1,0,mjacome,Equipo de mesa de ayuda,,,,,Normal,Normal
696164,1/19/2024 12:03,Error en mi tabla ReqJDEition,cvargas,Normal,Departamento de soporte de SAP JDE,Pedido,Web,Abierto,0,1,spaez,Equipo de soporte de JDE,,,,,Normal,Normal
111277,1/19/2024 13:54,Creación de una cuenta VPN,arodriguez,Normal,Departamento de soporte de SAP JDE,Pedido,Web,Cerrado,0,1,jsarango,Equipo de AWS,,,,,Normal,Normal
696093,1/19/2024 14:03,Ejecutar archivo SQR en CS 9.2,afernandez,Baja,Departamento Técnico Interno,Pedido,Correo electrónico,Resuelto,0,1,msandoval,Equipo de AWS,,,,,Baja,Baja
695053,1/19/2024 15:35,Instancia de desarrollo | Problema de vista de registro,jlopez,Alta,Departamento Técnico Interno,Incidente / Problema,Correo electrónico,Abierto,0,1,msandoval,Equipo de Salesforce,,,,,Alta,Alta
695902,1/19/2024 16:03,Analizador de personas para 132939,aramirez,Normal,Departamento de soporte de SAP JDE,Pedido,Correo electrónico,Cerrado,0,0,msandoval,Equipo de Salesforce,,,,,Normal,Normal
694847,1/22/2024 16:27,Cómo anular la configuración en un elemento creado,jperez,Normal,Departamento Técnico Interno,Pedido,Correo electrónico,Resuelto,0,0,rmorillo,Equipo de Workday,,,,,Normal,Normal
695366,1/24/2024 8:03,03/12/2020 11:37 a. m. Problema ODSM,vcastro,Alta,Departamento de soporte de SAP JDE,Pedido,Correo electrónico,Resuelto,1,0,msandoval,BPM - Equipo de soporte de ProcessMaker,,,,,Alta,Alta
695358,1/24/2024 9:36,Problema de jerarquía de aprobación de informes de gastos,mmartinez,Alta,Departamento Técnico Interno,Pedido,Web,Cerrado,0,1,jsarango,BPM - Equipo de soporte de ProcessMaker,,,,,Alta,Alta
111556,1/24/2024 13:05,Implementación de Java Web Start,mmartinez,Normal,Departamento de soporte de SAP JDE,Incidente / Problema,Web,Abierto,1,1,rmorillo,Equipo de soporte de JDE,,,,,Normal,Normal
111125,1/24/2024 13:36,Instancia de desarrollo (.83),cvargas,Normal,Departamento de soporte de SAP JDE,Pedido,Web,Cerrado,0,1,jsarango,Equipo de soporte de SAP,,,,,Normal,Normal
695898,1/24/2024 14:04,Problema del espacio de trabajo después de actualizar la versión de BPM,lmartinez,Alta,Departamento Técnico Interno,Pedido,Web,Abierto,1,0,nenriquez,Equipo de Workday,,,,,Alta,Alta
696017,1/24/2024 16:09,Instancia de prueba JDE: criterios de búsqueda de notificaciones,lfernandez,Normal,Departamento de soporte de SAP JDE,Pedido,Web,Cerrado,1,0,msandoval,Equipo de mesa de ayuda,,,,,Normal,Normal
695443,1/25/2024 8:15,Permiso de clase de FOR 200-3 en UPLB,dmartinez,Alta,Departamento Técnico Interno,Pedido,Web,Cerrado,0,1,msandoval,Equipo de soporte de JDE,,,,,Alta,Alta
694828,1/25/2024 13:17,"Problema posterior: Aparece el mensaje ""No queda espacio en el dispositivo""",mgomez,Normal,Departamento Técnico Interno,Pedido,Web,Cerrado,1,0,msandoval,Equipo de Salesforce,,,,,Normal,Normal
695876,1/26/2024 11:02,Ver la página de error de saldo de licencia,cgomez,Baja,Departamento Técnico Interno,Incidente / Problema,Web,Resuelto,1,1,rmorillo,BPM - Equipo de soporte de ProcessMaker,,,,,Baja,Baja
696680,1/26/2024 13:51,Error al cargar la lista de posiciones en la autorización para viajar,jlopez,Urgente,Departamento Técnico Interno,Pedido,Web,Resuelto,0,1,rmorillo,Equipo de AWS,,,,,Urgente,Urgente
695865,1/29/2024 9:28,Formulario accesos especiales,svargas,Alta,Departamento de soporte de SAP JDE,Pedido,Web,Cerrado,1,0,jsarango,Equipo de Workday,,,,,,Alta
695299,1/29/2024 9:38,Mantenimiento programado de Sistemas Transversales Gubernamentales,jvargas,Baja,Departamento de soporte de SAP JDE,Incidente / Problema,Web,Abierto,1,1,msandoval,BPM - Equipo de soporte de ProcessMaker,,,,,,Baja
694883,1/29/2024 9:47,Instalar Firma EC,smartinez,Baja,Departamento Técnico Interno,Incidente / Problema,Correo electrónico,Resuelto,1,1,rmorillo,Equipo de AWS,,,,,,Baja
111199,1/29/2024 10:33,El servidor DEV no puede iniciarse,lmartinez,Alta,Departamento de soporte de SAP JDE,Incidente / Problema,Web,Cerrado,0,1,jsarango,Equipo de soporte de SAP,,,,,Alta,Alta
111221,1/29/2024 10:36,No se puede rescindir la asignación de un empleado,svargas,Alta,Departamento de soporte de SAP JDE,Incidente / Problema,Web,Cerrado,0,1,jsarango,Equipo de soporte de JDE,,,,,Alta,Alta
696336,1/29/2024 16:08,Solicitar ECI para la página del asesor estudiantil,mgomez,Baja,Departamento Técnico Interno,Pedido,Web,Abierto,1,1,nenriquez,Equipo de Salesforce,,,,,Baja,Baja
694877,1/30/2024 12:00,Formulario accesos especiales,alopez,Alta,Departamento de soporte de SAP JDE,Incidente / Problema,Correo electrónico,Abierto,0,1,msandoval,Equipo de soporte de JDE,,,,,,Alta
696193,1/31/2024 13:54,Encuentre la tabla de Oracle de ocupación de puestos,lramirez,Alta,Departamento Técnico Interno,Incidente / Problema,Web,Cerrado,0,1,nenriquez,Equipo de mesa de ayuda,,,,,Alta,Alta
694978,2/1/2024 16:11,[SAP] La página no está disponible,vgomez,Normal,Departamento de soporte de SAP JDE,Incidente / Problema,Correo electrónico,Abierto,1,0,spaez,Equipo de mesa de ayuda,,,,,Normal,Normal
695142,2/2/2024 9:32,Crear contabilidad - Error de clase de contabilidad,mfernandez,Alta,Departamento de soporte de SAP JDE,Incidente / Problema,Correo electrónico,Abierto,1,1,rmorillo,Equipo de red,,,,,Alta,Alta
695946,2/2/2024 12:39,No se puede acceder a la instancia de desarrollo,scastro,Baja,Departamento de soporte de SAP JDE,Pedido,Correo electrónico,Cerrado,0,1,jsarango,Equipo de Salesforce,,,,,Baja,Baja
695934,2/2/2024 16:11,Rendimiento lento y batería Dell defectuosa,vmartinez,Normal,Departamento Técnico Interno,Pedido,Web,Cerrado,1,0,spaez,Equipo de mesa de ayuda,,,,,Normal,Normal
696227,2/5/2024 9:54,Cálculo de GWA entre registros,lgomez,Normal,Departamento Técnico Interno,Pedido,Web,Abierto,1,1,msandoval,Equipo de Workday,,,,,Normal,Normal
111446,2/5/2024 11:01,Adjunto URL - Autorización para rellenar,smorales,Alta,Departamento de soporte de SAP JDE,Incidente / Problema,Web,Cerrado,0,1,jsarango,Equipo de soporte de JDE,,,,,Alta,Alta
696083,2/5/2024 12:31,Reparación de portátiles,drodriguez,Urgente,Departamento de soporte de SAP JDE,Incidente / Problema,Web,Resuelto,1,1,msandoval,BPM - Equipo de soporte de ProcessMaker,,,,,Urgente,Urgente
694965,2/7/2024 13:12,Acceso a bases de datos,jramirez,Normal,Departamento de soporte de SAP JDE,Pedido,Web,Cerrado,1,0,nenriquez,Equipo de Workday,,,,,Normal,Normal
696355,2/9/2024 8:09,VPN para instancias de Coloc,jfernandez,Normal,Departamento de soporte de SAP JDE,Incidente / Problema,Web,Cerrado,0,0,msandoval,Equipo de AWS,,,,,Normal,Normal
695180,2/9/2024 15:58,Solicitud Resmas de Papel DGDA ARCH,ccastro,Alta,Departamento Técnico Interno,Incidente / Problema,Correo electrónico,Resuelto,0,0,msandoval,Equipo de red,,,,,,Alta
696150,2/9/2024 16:24,Ordenar el nombre del elemento alfabéticamente,arodriguez,Normal,Departamento de soporte de SAP JDE,Pedido,Correo electrónico,Resuelto,0,1,rmorillo,Equipo de soporte de SAP,,,,,Normal,Normal
696518,2/12/2024 10:28,Error en el envío del PPMP,jmorales,Alta,Departamento Técnico Interno,Incidente / Problema,Web,Resuelto,1,0,spaez,Equipo de hardware,,,,,Alta,Alta
695687,2/12/2024 11:08,Instancia de prueba de JDE: proceso en segundo plano del flujo de trabajo,smartinez,Normal,Departamento Técnico Interno,Pedido,Web,Cerrado,0,0,mjacome,Equipo de hardware,,,,,Normal,Normal
695514,2/12/2024 15:00,Caducidad de FORTIGATE 200E.,vfernandez,Urgente,Departamento de soporte de SAP JDE,Pedido,Web,Resuelto,1,0,nenriquez,Equipo de hardware,,,,,Urgente,Urgente
694943,2/15/2024 11:43,SIRHA: Justificación médica,dfernandez,Urgente,Departamento Técnico Interno,Incidente / Problema,Correo electrónico,Abierto,1,0,rmorillo,Equipo de Salesforce,,,,,,Urgente
696062,2/15/2024 14:04,Base salarial,arodriguez,Alta,Departamento de soporte de SAP JDE,Incidente / Problema,Web,Cerrado,1,1,jsarango,Equipo de Workday,,,,,Alta,Alta
111197,2/16/2024 8:43,No se pueden imprimir recibos de sueldo ni informes de nómina,cmorales,Normal,Departamento de soporte de SAP JDE,Incidente / Problema,Correo electrónico,Cerrado,0,1,jsarango,Equipo de soporte de JDE,,,,,Normal,Normal
695238,2/16/2024 11:24,El motor 3C no funciona,dmartinez,Normal,Departamento Técnico Interno,Pedido,Correo electrónico,Resuelto,0,0,rmorillo,Equipo de hardware,,,,,Normal,Normal
695849,2/16/2024 14:39,No podemos encontrar UP_FORM5_1.,afernandez,Baja,Departamento Técnico Interno,Pedido,Web,Abierto,1,1,jsarango,Equipo de Workday,,,,,Baja,Baja
696255,2/19/2024 9:35,Generando el informe CHED_FT_2018,slopez,Normal,Departamento de soporte de SAP JDE,Pedido,Correo electrónico,Resuelto,1,0,msandoval,Equipo de hardware,,,,,Normal,Normal
694916,2/19/2024 13:36,PROD: No se pueden eliminar registros en los campos de investigación,arodriguez,Normal,Departamento de soporte de SAP JDE,Incidente / Problema,Correo electrónico,Cerrado,0,1,msandoval,Equipo de Workday,,,,,Normal,Normal
111522,2/19/2024 14:09,Problema de contraseña (AY 2020-2021 1er semestre),lfernandez,Normal,Departamento de soporte de SAP JDE,Incidente / Problema,Web,Cerrado,0,1,jsarango,Equipo de soporte de SAP,,,,,Normal,Normal
695912,2/19/2024 16:05,Instalar Firma EC,aperez,Baja,Departamento Técnico Interno,Pedido,Web,Resuelto,0,1,mjacome,Equipo de red,,,,,,Normal
696318,2/20/2024 11:00,PROD: Restricciones en el conjunto de asignaciones,amorales,Normal,Departamento Técnico Interno,Pedido,Web,Cerrado,1,0,spaez,Equipo de Workday,,,,,Normal,Normal
696155,2/20/2024 11:30,Valor único para la transacción Flexfield Issue,drodriguez,Normal,Departamento Técnico Interno,Incidente / Problema,Web,Abierto,1,0,rmorillo,Equipo de Salesforce,,,,,Normal,Normal
696341,2/21/2024 14:07,Solicitud de reinicio del servidor,cmartinez,Normal,Departamento Técnico Interno,Pedido,Web,Abierto,1,0,msandoval,Equipo de red,,,,,Normal,Normal
696199,2/21/2024 14:34,Problema de rendimiento lento de SAP,dvargas,Normal,Departamento Técnico Interno,Pedido,Correo electrónico,Resuelto,1,1,nenriquez,Equipo de red,,,,,Normal,Normal
696113,2/22/2024 16:07,Error al crear la Organización en TEST,aramirez,Normal,Departamento Técnico Interno,Incidente / Problema,Correo electrónico,Abierto,0,0,rmorillo,Equipo de soporte de JDE,,,,,Normal,Normal
111207,2/23/2024 8:02,Eliminar el acceso a la página de inscripción,vramirez,Normal,Departamento de soporte de SAP JDE,Pedido,Web,Cerrado,0,1,jsarango,Equipo de soporte de SAP,,,,,Normal,Normal
695721,2/23/2024 8:17,Solicitud Resmas de Papel DGDA ARCH,sramirez,Alta,Departamento Técnico Interno,Pedido,Web,Resuelto,0,0,spaez,Equipo de Salesforce,,,,,,Urgente
695009,2/23/2024 11:02,[Solo prueba]:::[SAP]Página no disponible,ccastro,Normal,Departamento de soporte de SAP JDE,Incidente / Problema,Web,Cerrado,1,0,nenriquez,BPM - Equipo de soporte de ProcessMaker,,,,,Normal,Normal
695816,2/23/2024 14:49,Sistema de causas penales,dperez,Alta,Departamento Técnico Interno,Incidente / Problema,Web,Resuelto,0,0,msandoval,Equipo de soporte de SAP,,,,,Alta,Alta
696322,2/26/2024 9:46,Soporte para impresora y actualización de firma electrónica por cambio de CPU,jperez,Urgente,Departamento Técnico Interno,Pedido,Web,Resuelto,0,1,nenriquez,BPM - Equipo de soporte de ProcessMaker,,,,,,Urgente
695896,2/26/2024 12:55,"1900 correos electrónicos del flujo de trabajo de JDE, notificación del 22/02/2021",mcastro,Normal,Departamento de soporte de SAP JDE,Incidente / Problema,Correo electrónico,Cerrado,0,0,rmorillo,BPM - Equipo de soporte de ProcessMaker,,,,,Normal,Normal
696503,2/26/2024 13:39,Mostrar pie de página en el informe generado.,cramirez,Normal,Departamento de soporte de SAP JDE,Incidente / Problema,Correo electrónico,Resuelto,1,1,nenriquez,BPM - Equipo de soporte de ProcessMaker,,,,,Normal,Normal
696636,2/26/2024 15:16,"Faltan los PMP de SPMS 2016, 2017 y 2018",jperez,Alta,Departamento de soporte de SAP JDE,Incidente / Problema,Correo electrónico,Resuelto,0,1,rmorillo,Equipo de red,,,,,Alta,Alta
111313,2/26/2024 15:20,Modificación de campos en Aprendizaje Externo,crodriguez,Normal,Departamento de soporte de SAP JDE,Pedido,Web,Cerrado,0,1,jsarango,Equipo de soporte de JDE,,,,,Normal,Normal
111255,2/26/2024 16:11,Habilitar el Administrador de informes para todos,dmartinez,Normal,Departamento de soporte de SAP JDE,Pedido,Web,Cerrado,0,1,jsarango,Equipo de soporte de SAP,,,,,Normal,Normal
695685,2/27/2024 13:26,El proceso por lotes de grupos de estudiantes no funciona.,dvargas,Urgente,Departamento de soporte de SAP JDE,Incidente / Problema,Correo electrónico,Abierto,0,0,msandoval,Equipo de mesa de ayuda,,,,,Urgente,Urgente
694882,2/28/2024 8:43,Solicitud de visita in situ,lgomez,Alta,Departamento Técnico Interno,Incidente / Problema,Web,Cerrado,1,1,rmorillo,Equipo de soporte de JDE,,,,,Alta,Alta
111212,2/29/2024 11:17,Acceso a bases de datos,clopez,Normal,Departamento de soporte de SAP JDE,Pedido,Web,Cerrado,0,1,nenriquez,Equipo de soporte de SAP,,,,,Normal,Normal
696238,3/1/2024 9:11,Cómo obtener una imagen en BI Publisher,alopez,Normal,Departamento de soporte de SAP JDE,Incidente / Problema,Web,Resuelto,1,0,nenriquez,Equipo de red,,,,,Normal,Normal
111205,3/1/2024 9:58,Roles del profesorado para visualizar el informe de consultas,vperez,Baja,Departamento de soporte de SAP JDE,Pedido,Web,Cerrado,0,1,jsarango,Equipo de soporte de SAP,,,,,Baja,Baja
695558,3/1/2024 12:24,La UPOU no puede imprimir SALN,drodriguez,Alta,Departamento de soporte de SAP JDE,Pedido,Web,Resuelto,1,0,spaez,Equipo de mesa de ayuda,,,,,Alta,Alta
695105,3/1/2024 16:10,Error al cargar la plantilla en la definición del informe,sramirez,Alta,Departamento Técnico Interno,Pedido,Correo electrónico,Cerrado,1,1,rmorillo,Equipo de soporte de JDE,,,,,Alta,Alta
696242,3/4/2024 12:08,Analizador de personas para 132939,afernandez,Normal,Departamento de soporte de SAP JDE,Incidente / Problema,Correo electrónico,Resuelto,1,1,rmorillo,Equipo de soporte de SAP,,,,,Normal,Normal
111419,3/4/2024 12:26,Los procesos están en stock en cola,sramirez,Normal,Departamento de soporte de SAP JDE,Incidente / Problema,Web,Cerrado,0,1,jsarango,Equipo de soporte de SAP,,,,,Normal,Normal
695292,3/4/2024 13:48,Ningún estudiante inscrito en la clase.,lgomez,Normal,Departamento de soporte de SAP JDE,Incidente / Problema,Correo electrónico,Abierto,0,0,jsarango,Equipo de Workday,,,,,Normal,Normal
695753,3/4/2024 15:22,PeopleTools 8.57 en la máquina cliente,clopez,Normal,Departamento de soporte de SAP JDE,Incidente / Problema,Web,Cerrado,0,0,mjacome,Equipo de red,,,,,Normal,Normal
695795,3/6/2024 10:19,Instancia de prueba: licencia expirada,lgomez,Alta,Departamento Técnico Interno,Pedido,Web,Cerrado,0,0,rmorillo,BPM - Equipo de soporte de ProcessMaker,,,,,Alta,Alta
695460,3/6/2024 15:54,Formato de fecha de prueba JDE,lmorales,Normal,Departamento Técnico Interno,Pedido,Web,Abierto,1,1,jsarango,Equipo de mesa de ayuda,,,,,Normal,Normal
696529,3/8/2024 8:50,Problema de licencia de vacaciones,cfernandez,Baja,Departamento Técnico Interno,Incidente / Problema,Correo electrónico,Cerrado,0,0,msandoval,Equipo de soporte de SAP,,,,,Baja,Baja
111623,3/8/2024 10:12,Analizador de personas para 132939,cperez,Normal,Departamento de soporte de SAP JDE,Pedido,Web,Abierto,0,0,rmorillo,Equipo de soporte de JDE,,,,,Normal,Normal
695486,3/8/2024 10:43,CAMBIAR CONTRASEÑA Y CONFIRMACIÓN DE CORREO ELECTRÓNICO,Agomez,Normal,Departamento de soporte de SAP JDE,Incidente / Problema,Correo electrónico,Abierto,1,0,rmorillo,Equipo de Workday,,,,,Normal,Normal
696020,3/8/2024 13:11,Asuntos de licencia especial,mvargas,Normal,Departamento Técnico Interno,Incidente / Problema,Correo electrónico,Abierto,1,1,mjacome,Equipo de mesa de ayuda,,,,,Normal,Normal
695249,3/11/2024 9:19,Rendimiento lento,afernandez,Alta,Departamento de soporte de SAP JDE,Incidente / Problema,Web,Resuelto,1,0,msandoval,Equipo de mesa de ayuda,,,,,Alta,Alta
696281,3/11/2024 11:15,Bajo rendimiento,slopez,Urgente,Departamento Técnico Interno,Incidente / Problema,Correo electrónico,Cerrado,1,1,nenriquez,Equipo de AWS,,,,,Urgente,Urgente
695571,3/11/2024 14:25,PROD: Error Value Scholar ha sido deshabilitado,vlopez,Normal,Departamento Técnico Interno,Pedido,Correo electrónico,Resuelto,1,0,rmorillo,Equipo de hardware,,,,,Normal,Normal
695541,3/11/2024 16:06,[Solo prueba]:::[SAP]Página no disponible,dlopez,Normal,Departamento de soporte de SAP JDE,Pedido,Web,Resuelto,1,0,nenriquez,Equipo de Salesforce,,,,,Normal,Normal
694835,3/11/2024 16:30,Cuenta VPN,jfernandez,Normal,Departamento de soporte de SAP JDE,Incidente / Problema,Correo electrónico,Abierto,0,0,mjacome,Equipo de red,,,,,Normal,Normal
111103,3/13/2024 9:52,Problema en las rutas de informes,clopez,Normal,Departamento de soporte de SAP JDE,Incidente / Problema,Correo electrónico,Cerrado,0,1,msandoval,Equipo de soporte de JDE,,,,,Normal,Normal
695057,3/13/2024 15:00,Las transacciones se están aplazando,mvargas,Alta,Departamento Técnico Interno,Pedido,Correo electrónico,Cerrado,1,1,mjacome,Equipo de red,,,,,Alta,Alta
695627,3/14/2024 16:05,"Envío de notificaciones por correo electrónico (año académico 2020-2021, 1.er semestre)",slopez,Normal,Departamento Técnico Interno,Pedido,Web,Cerrado,0,1,spaez,Equipo de Salesforce,,,,,Normal,Normal
696202,3/14/2024 16:17,Los tickets de prueba no aparecen,dmartinez,Normal,Departamento de soporte de SAP JDE,Incidente / Problema,Correo electrónico,Cerrado,1,0,msandoval,Equipo de red,,,,,Normal,Normal
695760,3/15/2024 11:04,Sobrecarga de unidades,cvargas,Normal,Departamento de soporte de SAP JDE,Incidente / Problema,Correo electrónico,Abierto,0,1,jsarango,Equipo de red,,,,,Normal,Normal
695052,3/15/2024 14:32,Instancia de desarrollo | Problema de vista de registro,mfernandez,Alta,Departamento Técnico Interno,Pedido,Correo electrónico,Abierto,1,0,rmorillo,Equipo de Workday,,,,,Alta,Alta
111520,3/15/2024 15:39,"Número de ODSM (año académico 2020-2021, 1.er semestre)",sramirez,Normal,Departamento de soporte de SAP JDE,Incidente / Problema,Web,Cerrado,0,1,jsarango,Equipo de soporte de SAP,,,,,Normal,Normal
694851,3/18/2024 9:26,Encuentre la tabla de Oracle de ocupación de puestos,dgomez,Alta,Departamento Técnico Interno,Incidente / Problema,Correo electrónico,Abierto,0,1,msandoval,Equipo de soporte de JDE,,,,,Alta,Alta
111547,3/18/2024 11:33,Nueva cuenta VPN,dmartinez,Normal,Departamento Técnico Interno,Pedido,Web,Cerrado,0,1,jsarango,Equipo de mesa de ayuda,,,,,Normal,Normal
694830,3/18/2024 14:50,PROD: Buscar una tabla específica en Oracle,aperez,Normal,Departamento Técnico Interno,Incidente / Problema,Correo electrónico,Abierto,0,1,mjacome,Equipo de red,,,,,Normal,Normal
695965,3/18/2024 15:06,Creación de cuentas VPN,mvargas,Normal,Departamento Técnico Interno,Pedido,Web,Cerrado,0,0,jsarango,Equipo de AWS,,,,,Normal,Normal
111353,3/18/2024 15:42,No puedo acceder a mi cuenta,vfernandez,Alta,Departamento de soporte de SAP JDE,Incidente / Problema,Web,Cerrado,0,1,jsarango,Equipo de soporte de SAP,,,,,Alta,Alta
695018,3/19/2024 12:56,Carga lenta de SAP 10 de enero de 2020,mramirez,Alta,Departamento Técnico Interno,Pedido,Web,Abierto,1,0,jsarango,Equipo de soporte de SAP,,,,,Alta,Alta
111415,3/20/2024 11:21,COS- Error de aplicación se ha producido en su proceso,sgomez,Normal,Departamento de soporte de SAP JDE,Incidente / Problema,Web,Cerrado,0,1,jsarango,Equipo de soporte de JDE,,,,,Normal,Normal
696063,3/22/2024 8:35,Instalación y configuración de ESET,dvargas,Alta,Departamento de soporte de SAP JDE,Pedido,Correo electrónico,Abierto,0,1,nenriquez,Equipo de red,,,,,Alta,Alta
696353,3/22/2024 10:11,Eliminar o revertir una ejecución de nómina,lcastro,Urgente,Departamento Técnico Interno,Pedido,Correo electrónico,Cerrado,1,0,msandoval,Equipo de Salesforce,,,,,Urgente,Urgente
695005,3/22/2024 14:43,Solicitud de visita in situ,sgomez,Alta,Departamento de soporte de SAP JDE,Incidente / Problema,Correo electrónico,Abierto,0,1,jsarango,Equipo de Salesforce,,,,,Alta,Alta
695668,3/22/2024 15:26,JDE PROD - Advertencia de creación de contabilidad completada,vvargas,Normal,Departamento de soporte de SAP JDE,Pedido,Web,Cerrado,1,0,jsarango,Equipo de soporte de JDE,,,,,Normal,Normal
111649,3/25/2024 8:30,Error al cargar la plantilla en la definición del informe,lfernandez,Alta,Departamento de soporte de SAP JDE,Incidente / Problema,Web,Abierto,0,1,mjacome,Equipo de soporte de SAP,,,,,Alta,Alta
695757,3/25/2024 9:54,Error al cargar la lista de posiciones en la autorización para viajar,vperez,Urgente,Departamento de soporte de SAP JDE,Pedido,Correo electrónico,Resuelto,1,1,rmorillo,Equipo de soporte de JDE,,,,,Urgente,Urgente
696590,3/25/2024 11:14,Error de SQL del Administrador de acceso SQL,vlopez,Urgente,Departamento Técnico Interno,Incidente / Problema,Correo electrónico,Cerrado,1,0,msandoval,Equipo de red,,,,,Urgente,Urgente
694897,3/25/2024 15:00,Preocupación por borrar la caché del navegador,lramirez,Baja,Departamento Técnico Interno,Incidente / Problema,Web,Cerrado,0,0,mjacome,Equipo de AWS,,,,,Baja,Baja
111198,3/25/2024 16:18,Las transacciones se están aplazando,scastro,Alta,Departamento de soporte de SAP JDE,Incidente / Problema,Web,Cerrado,0,1,jsarango,Equipo de soporte de JDE,,,,,Alta,Alta
695507,3/26/2024 16:14,CAMBIAR CONTRASEÑA Y CONFIRMACIÓN DE CORREO ELECTRÓNICO,smartinez,Normal,Departamento Técnico Interno,Incidente / Problema,Web,Resuelto,1,0,msandoval,Equipo de hardware,,,,,Normal,Normal
695061,3/27/2024 10:02,Información STC,jmartinez,Alta,Departamento Técnico Interno,Pedido,Correo electrónico,Abierto,1,1,spaez,Equipo de Salesforce,,,,,,Alta
696060,3/27/2024 11:40,ACTUALIZACION DE FIRMA,dperez,Urgente,Departamento Técnico Interno,Pedido,Web,Abierto,1,1,rmorillo,Equipo de red,,,,,,Normal
696430,3/28/2024 12:46,INSTALAR SCANER MARCA CANON MODELO P-150,vramirez,Baja,Departamento de soporte de SAP JDE,Pedido,Web,Cerrado,1,0,msandoval,Equipo de hardware,,,,,,Baja
111586,3/29/2024 8:24,Configuración de VPN,jrodriguez,Urgente,Departamento de soporte de SAP JDE,Pedido,Web,Cerrado,0,1,jsarango,Equipo de soporte de JDE,,,,,Alta,Alta
696704,3/29/2024 8:38,Ralentización de la instancia de prueba de JDE,cmorales,Normal,Departamento de soporte de SAP JDE,Incidente / Problema,Correo electrónico,Abierto,1,1,spaez,Equipo de mesa de ayuda,,,,,Normal,Normal
695735,3/29/2024 12:09,Página de autorización para contratar deshabilitada,crodriguez,Normal,Departamento Técnico Interno,Pedido,Correo electrónico,Resuelto,1,1,msandoval,Equipo de red,,,,,Normal,Normal
696326,3/29/2024 13:13,Diseñador de aplicaciones en 9.0 PROD,cfernandez,Alta,Departamento de soporte de SAP JDE,Pedido,Web,Abierto,0,0,nenriquez,Equipo de soporte de SAP,,,,,Alta,Alta
695343,3/29/2024 13:38,"Salida de expresión en el Administrador de consultas,",lperez,Normal,Departamento de soporte de SAP JDE,Incidente / Problema,Web,Resuelto,1,1,mjacome,Equipo de red,,,,,Normal,Normal
695066,3/29/2024 13:39,Creación de nodos separados,mgomez,Normal,Departamento de soporte de SAP JDE,Incidente / Problema,Correo electrónico,Abierto,0,0,rmorillo,Equipo de AWS,,,,,Normal,Normal
696102,3/29/2024 16:17,INSTANCIA DE DESARROLLO DE SAP,svargas,Normal,Departamento de soporte de SAP JDE,Incidente / Problema,Correo electrónico,Abierto,1,0,nenriquez,Equipo de soporte de SAP,,,,,Normal,Normal
